name,location,property_type,accommodates,amenities,price,min_nights,max_nights,review_rating,tags
stylish & bright 2 bed 2 bath lower level retreat,princess-rosethorn,entire home,4,"55 inch hdtv, wine glasses, wifi, freezer, pets allowed, blender, dining table, kitchen, hot water, board games, shampoo, private entrance, shower gel, clothing storage, baking sheet, first aid kit, bathtub, room-darkening shades, coffee, keypad, dishes and silverware, free dryer – in unit, central air conditioning, dedicated workspace, free washer – in unit, induction stove, free parking on premises, toaster, iron, dishwasher, central heating, conditioner, cooking basics, smoke alarm, coffee maker: drip coffee maker, barbecue utensils, self check-in, cleaning available during stay, hangers, hair dryer, extra pillows and blankets, carbon monoxide alarm, cleaning products, fire extinguisher, microwave, single oven, hot water kettle, essentials, refrigerator, bed linens, long term stays allowed, body soap",106.0,29,365,5.0,"bath, bright, stylish"
private one bedroom apartment,brookhaven-amesbury,entire condo,2,"wifi, ethernet connection, freezer, children’s dinnerware, laundromat nearby, window ac unit, dining table, kitchen, hot water, first aid kit, outlet covers, bathtub, stove, dishes and silverware, tv, free dryer – in unit, host greets you, dedicated workspace, free washer – in unit, free parking on premises, clothing storage: closet and dresser, iron, baby bath, central heating, cooking basics, smoke alarm, oven, baby safety gates, hangers, hair dryer, extra pillows and blankets, carbon monoxide alarm, cleaning products, portable fans, fire extinguisher, long term stays allowed, hot water kettle, essentials, refrigerator, exercise equipment, ceiling fan, bed linens, portable heater, body soap",195.0,30,90,4.75,"apartment, private"
"private room #3_toronto close to everything,ttc",eglinton east,private room in home,1,"lockbox, drying rack for clothing, wine glasses, paid parking on premises, wifi, ethernet connection, freezer, laundromat nearby, blender, free washer – in building, dining table, kitchen, hot water, private entrance, shampoo, free street parking, shower gel, baking sheet, first aid kit, outdoor furniture, bikes, bathtub, room-darkening shades, stove, coffee, ev charger, dishes and silverware, hdtv, free dryer – in unit, central air conditioning, lock on bedroom door, dedicated workspace, shared patio or balcony, free parking on premises, toaster, iron, central heating, conditioner, cooking basics, smoke alarm, private backyard – fully fenced, oven, barbecue utensils, self check-in, cleaning available during stay, hangers, hair dryer, extra pillows and blankets, carbon monoxide alarm, cleaning products, fire extinguisher, microwave, clothing storage: walk-in closet, coffee maker, hot water kettle, essentials, refrigerator, resort access, bed linens, outdoor playground, long term stays allowed, bbq grill, body soap",63.0,28,1125,4.7,"private, private room"
"modern, near transit, supermarket, free parking",briar hill-belgravia,private room in home,2,"drying rack for clothing, wine glasses, wifi, freezer, bread maker, laundromat nearby, blender, dining table, kitchen, hot water, welcome starter kit body soap, rice maker, private entrance, free street parking, exterior security cameras on property, shower gel, baking sheet, first aid kit, luggage dropoff allowed, books and reading material, whirlpool stainless steel electric stove, bathtub, room-darkening shades, coffee, dishes and silverware, central air conditioning, lock on bedroom door, host greets you, whirlpool refrigerator, dedicated workspace, clothing storage: closet and dresser, iron, dishwasher, central heating, cooking basics, private backyard – fully fenced, smoke alarm, mosquito net, barbecue utensils, welcome starter kit conditioner, welcome starter kit shampoo, cleaning available during stay, free driveway parking on premises – 3 spaces, hangers, hair dryer, extra pillows and blankets, carbon monoxide alarm, cleaning products, fire extinguisher, microwave, coffee maker: french press, keurig coffee machine, pour-over coffee, hot water kettle, paid washer – in unit, essentials, whirlpool stainless steel single oven, paid dryer – in unit, mini fridge, bed linens, long term stays allowed, toaster",88.0,2,300,5.0,"free parking, king, modern, parking"
new 1 bdrm + den condo,moss park,entire rental unit,4,"single level home, outdoor dining area, kitchen, hot water, shampoo, building staff, outdoor furniture, elevator, luggage dropoff allowed, park view, 50 inch hdtv with chromecast, bathtub, room-darkening shades, fast wifi – 827 mbps, stove, lake view, dryer, dishes and silverware, washer, dedicated workspace, iron, dishwasher, paid parking off premises, city skyline view, cooking basics, smoke alarm, self check-in, oven, hangers, hair dryer, extra pillows and blankets, carbon monoxide alarm, fire extinguisher, microwave, private patio or balcony, air conditioning, shared gym in building, essentials, lake access, refrigerator, heating, exercise equipment, bed linens, pocket wifi, bbq grill",243.0,2,180,4.78,condo
elevated living at the heart of toronto,waterfront communities-the island,entire condo,4,"lockbox, wine glasses, paid parking on premises, wifi, freezer, kitchen, hot water, shampoo, clothing storage, shower gel, first aid kit, pool, stove, coffee, dryer, dishes and silverware, tv, washer, dedicated workspace, dishwasher, conditioner, cooking basics, smoke alarm, self check-in, oven, hair dryer, fire extinguisher, carbon monoxide alarm, cleaning products, microwave, air conditioning, coffee maker, hot water kettle, essentials, refrigerator, heating, bed linens, toaster",221.0,2,365,5.0,waterfront
"master br, ace location, lake view, path connected",waterfront communities-the island,private room in condo,1,"paid parking on premises, wifi, kitchen, hot water, shampoo, elevator, luggage dropoff allowed, stove, dryer, dishes and silverware, washer, lock on bedroom door, host greets you, tv with standard cable, iron, cooking basics, smoke alarm, oven, hangers, hair dryer, fire extinguisher, extra pillows and blankets, carbon monoxide alarm, microwave, patio or balcony, air conditioning, waterfront, essentials, refrigerator, heating, bed linens, long term stays allowed",77.0,28,365,5.0,"master, view, waterfront"
one bedroom luxury condo w free parking & gym,woburn,entire rental unit,3,"lockbox, wine glasses, wifi, dining table, kitchen, hot water, shampoo, clothing storage, shower gel, books and reading material, bathtub, room-darkening shades, stove, coffee, dryer, dishes and silverware, washer, dedicated workspace, free parking on premises, iron, dishwasher, cooking basics, smoke alarm, self check-in, oven, hangers, hair dryer, extra pillows and blankets, carbon monoxide alarm, cleaning products, microwave, air conditioning, coffee maker, hot water kettle, essentials, refrigerator, heating, exercise equipment, bed linens",259.0,1,365,4.88,"condo, free parking, king, luxury, parking"
stylish chic 1br condo in downtown toronto,waterfront communities-the island,entire condo,3,"wifi, freezer, dining table, kitchen, shampoo, clothing storage, baking sheet, first aid kit, elevator, bathtub, stove, dishes and silverware, free dryer – in unit, central air conditioning, dedicated workspace, free washer – in unit, toaster, iron, dishwasher, central heating, paid parking off premises, conditioner, cooking basics, smoke alarm, oven, hangers, hair dryer, extra pillows and blankets, carbon monoxide alarm, cleaning products, fire extinguisher, microwave, patio or balcony, coffee maker, hot water kettle, essentials, refrigerator, bed linens, 55 inch tv, long term stays allowed, body soap, housekeeping - available at extra cost",191.0,1,365,4.82,"condo, downtown, stylish, waterfront"
luxurious modern 7b3.5b home + magnificent patio,l'amoreaux,entire home,16,"wifi, freezer, indoor fireplace, outdoor dining area, dining table, kitchen, hot water, private entrance, shampoo, exterior security cameras on property, shower gel, baking sheet, first aid kit, outdoor furniture, clothing storage: closet, room-darkening shades, stove, coffee, dishes and silverware, tv, free dryer – in unit, washer, backyard, dedicated workspace, toaster, iron, dishwasher, central heating, conditioner, cooking basics, smoke alarm, self check-in, oven, barbecue utensils, crib, hangers, hair dryer, extra pillows and blankets, carbon monoxide alarm, cleaning products, microwave, patio or balcony, pack ’n play/travel crib - always at the listing, air conditioning, coffee maker, hot water kettle, essentials, refrigerator, smart lock, free parking garage on premises, bed linens, bbq grill, body soap",248.0,28,365,4.88,"luxurious, modern"
view cn tower/lake from the sky!,waterfront communities-the island,entire rental unit,4,"wine glasses, freezer, ethernet connection, laundromat nearby, indoor fireplace: electric, blender, dining table, hot water, shampoo, building staff, shower gel, baking sheet, safe, room-darkening shades, lake view, coffee, aeg induction stove, dishes and silverware, shared pool - available seasonally, free dryer – in unit, central air conditioning, free washer – in unit, toaster, iron, dishwasher, 65 inch hdtv with amazon prime video, apple tv, netflix, premium cable, dvd player, central heating, city skyline view, conditioner, cooking basics, self check-in, bose sound system with aux, hangers, hair dryer, extra pillows and blankets, private patio or balcony, cleaning products, microwave, aeg single oven, hot water kettle, shared beach access, waterfront, shared gym in building, essentials, lake access, clothing storage: walk-in closet, closet, and dresser, sun loungers, exercise equipment, bed linens, coffee maker: nespresso, aeg refrigerator, body soap",750.0,1,365,5.0,"view, waterfront"
striking 2bdrm condo w/ balcony views!,waterfront communities-the island,entire condo,3,"wine glasses, shared sauna, paid parking on premises, freezer, pets allowed, dining table, kitchen, hot water, shampoo, clothing storage, baking sheet, outdoor furniture, elevator, bathtub, room-darkening shades, pool, stove, coffee, dryer, keypad, fast wifi – 331 mbps, tv, dishes and silverware, washer, dedicated workspace, toaster, iron, dishwasher, city skyline view, conditioner, smoke alarm, cooking basics, oven, paid pack ’n play/travel crib - available upon request, hot tub, self check-in, cleaning available during stay, hangers, hair dryer, extra pillows and blankets, carbon monoxide alarm, cleaning products, microwave, private patio or balcony, air conditioning, coffee maker, hot water kettle, shared gym in building, essentials, refrigerator, heating, bed linens, long term stays allowed, body soap",355.0,28,365,5.0,"balcony, condo, king, view, views, waterfront"
fully furnished apt yonge&shepp!,willowdale east,entire condo,4,"wifi, dining table, kitchen, hot water, shampoo, elevator, dryer, dishes and silverware, tv, washer, dedicated workspace, free parking on premises, iron, dishwasher, cooking basics, smoke alarm, hangers, hair dryer, fire extinguisher, carbon monoxide alarm, microwave, long term stays allowed, air conditioning, coffee maker, essentials, refrigerator, portable heater",147.0,28,365,4.0,furnished
downtown toronto urban retreat!,dovercourt-wallace emerson-junction,entire guesthouse,2,"wine glasses, stainless steel oven, wifi, freezer, outdoor dining area, laundromat nearby, blender, kitchen, hot water, private entrance, shampoo, shower gel, baking sheet, first aid kit, outdoor furniture, books and reading material, luggage dropoff allowed, room-darkening shades, coffee, dishes and silverware, tv, free dryer – in unit, dedicated workspace, free washer – in unit, clothing storage: closet and dresser, toaster, iron, gas stove, dishwasher, central heating, paid street parking off premises, coffee maker: french press, nespresso, conditioner, cooking basics, smoke alarm, self check-in, hangers, hair dryer, extra pillows and blankets, carbon monoxide alarm, cleaning products, fire extinguisher, microwave, private patio or balcony, shared backyard – fully fenced, air conditioning, hot water kettle, essentials, refrigerator, smart lock, bed linens, long term stays allowed, body soap, housekeeping - available at extra cost",235.0,1,365,4.91,downtown
sanctuary loft w/ fireplace,mimico (includes humber bay shores),entire loft,2,"wifi, freezer, pets allowed, blender, dining table, kitchen, hot water, rice maker, free street parking, electric stove, shower gel, baking sheet, first aid kit, elevator, safe, bathtub, shared bbq grill: gas, coffee, dishes and silverware, free dryer – in unit, host greets you, dedicated workspace, free washer – in unit, free parking on premises, toaster, iron, dishwasher, central heating, conditioner, cooking basics, clothing storage: wardrobe and dresser, smoke alarm, oven, barbecue utensils, piano, hangers, 52 inch hdtv with amazon prime video, hair dryer, extra pillows and blankets, carbon monoxide alarm, cleaning products, fire extinguisher, microwave, air conditioning, indoor fireplace: gas, hot water kettle, argan & almond oil shampoo, essentials, refrigerator, ceiling fan, bed linens, shared backyard, dove body soap, long term stays allowed, coffee maker: french press",315.0,28,120,5.0,loft
home in yonge and sheppard,willowdale east,entire home,4,"backyard - fully fenced, wine glasses, wifi, kitchen, hot water, rice maker, shampoo, private entrance, electric stove, exterior security cameras on property, clothing storage: walk-in closet and closet, coffee, dishes and silverware, tv, washer, dedicated workspace, free parking on premises, toaster, iron, central heating, conditioner, cooking basics, smoke alarm, coffee maker: drip coffee maker, hangers, hair dryer, extra pillows and blankets, carbon monoxide alarm, microwave, single oven, air conditioning, hot water kettle, essentials, refrigerator, dryer – in unit, bed linens, long term stays allowed, body soap",137.0,1,28,4.44,
"private bedroom, private toilet, free parking,",newtonbrook west,private room in home,2,"wine glasses, wifi, outdoor dining area, dining table, kitchen, hot water, free street parking, shampoo, shower gel, outdoor furniture, first aid kit, luggage dropoff allowed, stainless steel double oven, keypad, dishes and silverware, tv, lock on bedroom door, dedicated workspace, shared patio or balcony, free parking on premises, iron, stainless steel electric stove, cooking basics, smoke alarm, self check-in, hangers, hair dryer, fire extinguisher, carbon monoxide alarm, microwave, air conditioning, trash compactor, hot water kettle, essentials, refrigerator, heating, toaster",75.0,1,28,4.7,"free parking, king, parking, private"
toronto gem 2.5br/2bth free park,waterfront communities-the island,entire condo,5,"wine glasses, wifi, freezer, kitchen, hot water, shampoo, shower gel, elevator, first aid kit, clothing storage: closet, bathtub, stove, coffee, dishes and silverware, tv, free dryer – in unit, washer, dedicated workspace, free parking on premises, paid parking garage off premises, toaster, iron, dishwasher, central heating, cooking basics, smoke alarm, coffee maker: drip coffee maker, oven, self check-in, hangers, hair dryer, extra pillows and blankets, carbon monoxide alarm, cleaning products, microwave, air conditioning, smart lock, bed linens, body soap, housekeeping - available at extra cost",319.0,1,365,4.96,waterfront
modern comfort loft,agincourt south-malvern west,entire rental unit,4,"drying rack for clothing, wifi, freezer, outdoor dining area, pets allowed, dining table, kitchen, hot water, shampoo, electric stove, elevator, first aid kit, books and reading material, clothing storage: closet, bathtub, room-darkening shades, coffee, dishes and silverware, tv, washer, bidet, host greets you, dedicated workspace, free parking on premises, iron, pool table, dishwasher, cooking basics, smoke alarm, oven, hangers, hair dryer, extra pillows and blankets, carbon monoxide alarm, cleaning products, fire extinguisher, microwave, smoking allowed, air conditioning, trash compactor, hot water kettle, gym in building, essentials, refrigerator, dryer – in unit, heating, exercise equipment, bed linens, coffee maker: nespresso, bbq grill, body soap",79.0,28,1125,5.0,"loft, modern"
condo in downtown toronto w/ lake & cn tower view,niagara,entire condo,2,"lockbox, wine glasses, shared sauna, paid parking on premises, wifi, freezer, outdoor dining area, blender, dining table, kitchen, hot water, shampoo, shower gel, baking sheet, first aid kit, outdoor furniture, elevator, clothing storage: closet, bathtub, room-darkening shades, pool, stove, lake view, coffee, dishes and silverware, tv, free dryer – in unit, bidet, dedicated workspace, free washer – in unit, toaster, iron, pool table, dishwasher, central heating, paid parking off premises, city skyline view, cooking basics, smoke alarm, coffee maker: drip coffee maker, oven, hot tub, self check-in, hangers, hair dryer, extra pillows and blankets, carbon monoxide alarm, cleaning products, fire extinguisher, microwave, private patio or balcony, air conditioning, trash compactor, hot water kettle, shared gym in building, waterfront, essentials, refrigerator, exercise equipment, bed linens, long term stays allowed, bbq grill, body soap",233.0,2,365,5.0,"condo, downtown, view"
beautiful house,birchcliffe-cliffside,entire home,6,"wine glasses, stainless steel oven, wifi, freezer, indoor fireplace, dining table, kitchen, hot water, exterior security cameras on property, outdoor furniture, books and reading material, clothing storage: closet, bathtub, room-darkening shades, stove, keypad, dishes and silverware, tv, free dryer – in unit, washer, sono sound system, dedicated workspace, free parking on premises, iron, dishwasher, central heating, cooking basics, private backyard – fully fenced, smoke alarm, self check-in, hangers, hair dryer, carbon monoxide alarm, private patio or balcony, cleaning products, microwave, air conditioning, coffee maker, hot water kettle, refrigerator, bed linens, long term stays allowed, bbq grill",479.0,28,1125,5.0,
modern king suite in king west,waterfront communities-the island,entire condo,3,"lockbox, wine glasses, wifi, 75 inch hdtv with roku, kitchen, washer – in unit, hot water, elevator, first aid kit, clothing storage: closet, dishes and silverware, free dryer – in unit, central air conditioning, iron, dishwasher, central heating, cooking basics, smoke alarm, self check-in, hangers, hair dryer, fire extinguisher, private patio or balcony, microwave, hot water kettle, bed linens, coffee maker: nespresso, long term stays allowed, toaster",225.0,1,40,4.95,"king, modern, suite, waterfront"
bright modern studio with terrace,caledonia-fairbank,entire guest suite,2,"wine glasses, paid parking on premises, wifi, freezer, pack ’n play/travel crib - available upon request, blender, kitchen, hot water, private entrance, shampoo, first aid kit, clothing storage: closet, stove, keypad, dryer, dishes and silverware, washer, iron, central heating, coffee maker: french press, nespresso, conditioner, cooking basics, smoke alarm, self check-in, oven, hangers, hair dryer, extra pillows and blankets, carbon monoxide alarm, portable fans, cleaning products, tv with fire tv, fire extinguisher, microwave, private patio or balcony, air conditioning, long term stays allowed, hot water kettle, essentials, refrigerator, mini fridge, bed linens, portable heater, toaster",110.0,3,1125,4.86,"bright, modern, studio"
sunnyside beach hideaway - private guest suite,south parkdale,entire guest suite,2,"drying rack for clothing, wine glasses, wifi, freezer, window ac unit, blender, dining table, kitchen, hot water, board games, shampoo, rice maker, private entrance, exterior security cameras on property, shower gel, clothing storage: walk-in closet and dresser, first aid kit, radiant heating, books and reading material, baking sheet, luggage dropoff allowed, bikes, dishes and silverware, free dryer – in unit, 52 inch hdtv, dedicated workspace, free washer – in unit, coffee maker: keurig coffee machine, free parking on premises, toaster, iron, dishwasher, paid street parking off premises, conditioner, cooking basics, smoke alarm, self check-in, oven, hangers, hair dryer, extra pillows and blankets, carbon monoxide alarm, cleaning products, portable fans, fire extinguisher, microwave, hot water kettle, shared beach access, essentials, refrigerator, beach essentials, smart lock, bed linens, long term stays allowed, body soap",100.0,28,120,5.0,"away, beach, private, suite, sunny"
cozy junior 1br entire condo,kensington-chinatown,entire condo,2,"paid parking on premises, wifi, freezer, pets allowed, kitchen, hot water, whirlpool double oven, elevator, luggage dropoff allowed, safe, bathtub, pool, stove, dryer, dishes and silverware, tv, host greets you, coffee maker: keurig coffee machine, iron, central heating, nivea body soap, cooking basics, smoke alarm, cleaning available during stay, maui shampoo, hangers, hair dryer, cleaning products, microwave, smoking allowed, air conditioning, maui conditioner, essentials, refrigerator, paid washer – in building, private gym nearby, long term stays allowed, toaster",81.0,28,365,5.0,"condo, cozy"
king bed luxury condo - cn tower view + parking,waterfront communities-the island,entire condo,7,"wine glasses, shared sauna, paid parking on premises, freezer, ethernet connection, pack ’n play/travel crib - available upon request, single level home, pool view, laundromat nearby, shared hot tub, dining table, kitchen, hot water, board games, shampoo, rice maker, private entrance, free residential garage on premises – 1 space, shower gel, clothing storage, baking sheet, first aid kit, outdoor furniture, books and reading material, elevator, bathtub, room-darkening shades, 75 inch hdtv with chromecast, crib - available upon request, folding or convertible high chair - available upon request, lake view, aeg stainless steel oven, coffee, dishes and silverware, fast wifi – 558 mbps, free dryer – in unit, central air conditioning, dedicated workspace, free washer – in unit, toaster, iron, paid parking lot off premises, harbor view, baby bath, dishwasher, central heating, shared outdoor pool - available seasonally, open specific hours, rooftop, city skyline view, conditioner, smoke alarm, mosquito net, children’s books and toys, cooking basics, barbecue utensils, self check-in, cleaning available during stay, hangers, hair dryer, extra pillows and blankets, carbon monoxide alarm, cleaning products, microwave, private patio or balcony, trash compactor, shared gym in building, waterfront, essentials, sun loungers, exercise equipment, aeg stainless steel stove, bed linens, building staff, coffee maker: drip coffee maker, french press, pour-over coffee, long term stays allowed, aeg refrigerator, body soap",402.0,1,178,4.85,"condo, king, luxury, parking, view, waterfront"
two bedroom suite,yonge-eglinton,private room in rental unit,5,"paid parking on premises, wifi, dining table, kitchen, hot water, shampoo, exterior security cameras on property, radiant heating, dishes and silverware, tv, lock on bedroom door, toaster, iron, smoke alarm, hangers, hair dryer, carbon monoxide alarm, microwave, air conditioning, coffee maker, essentials, refrigerator, paid dryer – in building, bed linens, paid washer – in building, body soap",213.0,28,365,5.0,suite
"toronto scarborough towncenter,",agincourt south-malvern west,private room in villa,2,"wifi, kitchen, hot water, shampoo, exterior security cameras on property, first aid kit, luggage dropoff allowed, stove, dishes and silverware, lock on bedroom door, smoke alarm, self check-in, hangers, hair dryer, fire extinguisher, extra pillows and blankets, microwave, carbon monoxide alarm, air conditioning, hot water kettle, essentials, lake access, refrigerator, heating, smart lock, bed linens, long term stays allowed",45.0,28,90,4.65,
bestoftoronto: rest and recharge spot,mimico (includes humber bay shores),entire home,12,"lockbox, wifi, freezer, laundromat nearby, pets allowed, dining table, hot water, private entrance, shampoo, exterior security cameras on property, shower gel, first aid kit, clothing storage: closet and wardrobe, room-darkening shades, tv, free dryer – in unit, free washer – in unit, free parking on premises, iron, central heating, stainless steel electric stove, kitchenette, private backyard – fully fenced, smoke alarm, self check-in, hangers, carbon monoxide alarm, fire extinguisher, cleaning products, microwave, air conditioning, refrigerator, bed linens, long term stays allowed, body soap, housekeeping - available at extra cost",259.0,2,365,3.92,best
cozy private guest suite in junction area,runnymede-bloor west village,private room in home,2,"drying rack for clothing, wine glasses, private living room, wifi, freezer, dining table, hot water, private entrance, shampoo, shower gel, first aid kit, bathtub, coffee, dryer, keypad, dishes and silverware, washer, lock on bedroom door, tv with standard cable, toaster, iron, paid parking off premises, conditioner, smoke alarm, self check-in, hangers, hair dryer, extra pillows and blankets, carbon monoxide alarm, portable fans, cleaning products, fire extinguisher, coffee maker, hot water kettle, essentials, refrigerator, heating, bed linens, long term stays allowed, body soap",133.0,3,31,4.94,"cozy, private, suite"
