name,location,property_type,accommodates,amenities,price,min_nights,max_nights,review_rating,tags
beautiful 1 bed 1 bath | richmond & duncan,waterfront communities-the island,entire condo,2,"paid parking on premises, wifi, outdoor dining area, shared hot tub, kitchen, hot water, shampoo, outdoor furniture, elevator, 43 inch hdtv with standard cable, dishes and silverware, free dryer – in unit, washer, central air conditioning, dedicated workspace, shared patio or balcony, iron, dishwasher, cooking basics, smoke alarm, self check-in, oven, hangers, hair dryer, fire extinguisher, extra pillows and blankets, carbon monoxide alarm, microwave, aeg electric stove, coffee maker, shared gym in building, essentials, refrigerator, heating, smart lock, bed linens, long term stays allowed, bbq grill",150.0,30,1125,4.85,"bath, waterfront"
adorable 1 bdrm. coach house w/patio,cabbagetown-south st.james town,entire guesthouse,2,"wine glasses, stainless steel oven, wifi, outdoor dining area, blender, dining table, kitchen, hot water, private entrance, electric stove, baking sheet, radiant heating, bathtub, dishes and silverware, free dryer – in unit, garden view, coffee maker: french press, free washer – in unit, clothing storage: closet and dresser, toaster, iron, dishwasher, cooking basics, smoke alarm, hangers, extra pillows and blankets, fire extinguisher, carbon monoxide alarm, portable air conditioning, cleaning products, microwave, private patio or balcony, shared backyard – fully fenced, long term stays allowed, hot water kettle, essentials, refrigerator, bed linens, portable heater, body soap",145.0,28,730,5.0,coach
beautiful boutique midtown home,briar hill-belgravia,entire home,7,"single level home, stainless steel oven, freezer, ethernet connection, outdoor dining area, laundromat nearby, dining table, kitchen, hot water, board games, shampoo, private entrance, exterior security cameras on property, shower gel, outdoor furniture, first aid kit, luggage dropoff allowed, 65 inch hdtv, clothing storage: closet, fast wifi – 522 mbps, bathtub, room-darkening shades, coffee, dishes and silverware, dedicated workspace, free parking on premises, toaster, iron, lg sound system with bluetooth and aux, central heating, stainless steel electric stove, paid street parking off premises, conditioner, cooking basics, smoke alarm, private backyard – fully fenced, barbecue utensils, self check-in, hangers, hair dryer, extra pillows and blankets, carbon monoxide alarm, cleaning products, portable air conditioning, portable fans, microwave, private patio or balcony, hot water kettle, essentials, refrigerator, smart lock, ceiling fan, bed linens, coffee maker: nespresso, outdoor playground, long term stays allowed, bbq grill, body soap",245.0,2,180,4.71,
renovated studio apartment,dovercourt-wallace emerson-junction,entire rental unit,2,"lockbox, wifi, kitchen, hot water, private entrance, first aid kit, stove, dryer, dishes and silverware, washer, backyard, cooking basics, smoke alarm, self check-in, oven, hangers, carbon monoxide alarm, microwave, coffee maker, air conditioning, essentials, refrigerator, heating",81.0,28,1125,4.67,"apartment, renovated, studio"
peaceful room in victorian house with hot tub,regent park,private room in home,2,"lockbox, drying rack for clothing, wine glasses, private living room, wifi, ethernet connection, freezer, outdoor dining area, blender, dining table, kitchen, hot water, shampoo, exterior security cameras on property, shower gel, clothing storage, baking sheet, first aid kit, outdoor furniture, books and reading material, luggage dropoff allowed, room-darkening shades, stove, coffee, dryer, dishes and silverware, tv, washer, bidet, lock on bedroom door, backyard, dedicated workspace, toaster, iron, dishwasher, hockey rink, paid parking off premises, conditioner, cooking basics, smoke alarm, hot tub, oven, self check-in, cleaning available during stay, hair dryer, carbon monoxide alarm, fire extinguisher, microwave, patio or balcony, air conditioning, hot water kettle, essentials, sun loungers, refrigerator, heating, bed linens, coffee maker: nespresso, outdoor playground, long term stays allowed, body soap",154.0,1,45,4.96,peaceful
stay safe and sleep tight - 10 mins away from dt,flemingdon park,private room in rental unit,1,"wifi, kitchen, hot water, free street parking, shampoo, shower gel, washer – in building, elevator, bathtub, room-darkening shades, stove, dishes and silverware, lock on bedroom door, dedicated workspace, dryer – in building, shared patio or balcony, iron, smoke alarm, oven, 65 inch hdtv with netflix, cleaning available during stay, hangers, hair dryer, extra pillows and blankets, microwave, coffee maker, essentials, refrigerator, heating",60.0,28,1125,4.56,"away, safe"
cozy room in a beautiful home,east end-danforth,private room in home,2,"iron, wifi, indoor fireplace, essentials, smoke alarm, heating, self check-in, dryer, keypad, fire extinguisher, tv, hangers, washer, lock on bedroom door, carbon monoxide alarm, kitchen, air conditioning",46.0,28,60,4.75,cozy
spacious main floor apartment- close to downtown,humewood-cedarvale,entire guest suite,2,"drying rack for clothing, wine glasses, wifi, freezer, bread maker, dining table, kitchen, hot water, private entrance, shampoo, shower gel, baking sheet, room-darkening shades, stove, coffee, keypad, dishes and silverware, central air conditioning, coffee maker: french press, dedicated workspace, clothing storage: closet and dresser, toaster, iron, cooking basics, smoke alarm, self check-in, oven, hangers, hair dryer, carbon monoxide alarm, fire extinguisher, portable fans, cleaning products, hdtv with amazon prime video, netflix, disney+, microwave, hot water kettle, essentials, refrigerator, heating, paid dryer – in building, bed linens, paid washer – in building, long term stays allowed, body soap",76.0,28,101,5.0,"apartment, downtown, spacious"
"forest hill suite with private bathroom, kitchen",forest hill south,private room in home,2,"private living room, wifi, ethernet connection, gym, dining table, kitchen, hot water, rice maker, shampoo, private entrance, free street parking, clothing storage, luggage dropoff allowed, books and reading material, safe, stove, coffee, dryer, keypad, dishes and silverware, free washer – in unit, free parking on premises, iron, dishwasher, cooking basics, smoke alarm, self check-in, oven, hangers, hair dryer, extra pillows and blankets, 24 inch hdtv with netflix, portable fans, cleaning products, carbon monoxide alarm, microwave, coffee maker, private backyard, hot water kettle, essentials, refrigerator, heating, exercise equipment, bed linens, long term stays allowed, body soap",180.0,1,10,4.67,"bath, private, suite"
stunning viewcentral downtown at waterfront+prkg,niagara,entire condo,4,"wine glasses, single level home, freezer, dining table, kitchen, hot water, shampoo, shower gel, outdoor furniture, elevator, bathtub, room-darkening shades, stove, keypad, dryer, dishes and silverware, tv, washer, coffee maker: keurig coffee machine, free parking on premises, iron, dishwasher, cooking basics, smoke alarm, mosquito net, oven, self check-in, hangers, hair dryer, extra pillows and blankets, carbon monoxide alarm, cleaning products, microwave, private patio or balcony, long term stays allowed, air conditioning, hot water kettle, shared gym in building, essentials, lake access, refrigerator, heating, bed linens, wifi – 42 mbps, shared indoor pool - available all year, open specific hours, toaster",136.0,28,1125,4.88,"central, downtown, view, waterfront"
1b:downtown/univoftoronto/ocad/ago/kensington/uhn,kensington-chinatown,private room in home,2,"free washer – in building, clothing storage: wardrobe, dining table, kitchen, hot water, shampoo, exterior security cameras on property, shower gel, baking sheet, radiant heating, bathtub, stove, dishes and silverware, tv, fast wifi – 91 mbps, backyard, lock on bedroom door, dryer – in building, toaster, iron, dishwasher, central heating, paid parking off premises, conditioner, cooking basics, smoke alarm, oven, hangers, hair dryer, extra pillows and blankets, carbon monoxide alarm, portable fans, fire extinguisher, microwave, long term stays allowed, air conditioning, coffee maker, essentials, refrigerator, bed linens, portable heater, body soap",160.0,28,1125,5.0,downtown
sweet + inviting toronto midtown one bedroom apt,oakwood village,entire rental unit,2,"paid parking on premises, wifi, outdoor dining area, indoor fireplace: electric, kitchen, hot water, board games, shampoo, private entrance, outdoor furniture, first aid kit, luggage dropoff allowed, bathtub, stove, keypad, dishes and silverware, tv, backyard, dedicated workspace, iron, paid parking off premises, cooking basics, baby monitor, smoke alarm, children’s books and toys, oven, self check-in, hangers, hair dryer, fire extinguisher, extra pillows and blankets, carbon monoxide alarm, microwave, patio or balcony, coffee maker, essentials, refrigerator, heating, bed linens, long term stays allowed, bbq grill",178.0,28,90,4.75,
"private home, 5 beds, rogers centre & free parking",waterfront communities-the island,entire rental unit,10,"lockbox, wine glasses, paid parking on premises, single level home, wifi, freezer, laundromat nearby, dining table, kitchen, hot water, shower gel, baking sheet, first aid kit, clothing storage: closet, bathtub, stove, housekeeping available from 11:00 am to 5:00 pm, every day - available at extra cost, coffee, dryer, dishes and silverware, tv, washer, paya conditioner, iron, dishwasher, cooking basics, smoke alarm, hot tub, oven, self check-in, hangers, hair dryer, extra pillows and blankets, carbon monoxide alarm, cleaning products, microwave, coffee maker, hot water kettle, paya shampoo, essentials, refrigerator, heating, bed linens, free residential garage on premises, long term stays allowed, body soap",532.0,1,365,5.0,"free parking, king, parking, private, waterfront"
charming 1 bedroom apartment @ eglinton & bayview,mount pleasant east,entire home,2,"wine glasses, wifi, freezer, laundromat nearby, ac - split type ductless system, free washer – in building, dining table, hot water, private entrance, free street parking, clothing storage, first aid kit, bathtub, room-darkening shades, stove, keypad, dishes and silverware, tv with standard cable, dishwasher, cooking basics, smoke alarm, self check-in, oven, hangers, carbon monoxide alarm, microwave, portable fans, hot water kettle, refrigerator, heating, ceiling fan, bed linens, free dryer – in building, toaster",75.0,28,75,3.0,"apartment, charming, view"
"private room, kitchen & bathroom",old east york,private room in home,1,"lockbox, wifi, hot water, exterior security cameras on property, dishes and silverware, tv, lock on bedroom door, clothing storage: closet and dresser, iron, kitchenette, cooking basics, smoke alarm, self check-in, carbon monoxide alarm, fire extinguisher, microwave, portable fans, hot water kettle, heating, mini fridge",64.0,1,28,5.0,"bath, private, private room"
minutes fr eaton centre & dundas sq + parking,regent park,entire condo,2,"wifi, kitchen, hot water, private entrance, shampoo, elevator, first aid kit, dryer, tv, washer, dedicated workspace, free parking on premises, iron, cooking basics, smoke alarm, hangers, hair dryer, carbon monoxide alarm, patio or balcony, coffee maker, air conditioning, essentials, heating",174.0,28,730,4.88,"king, parking"
designer 2bd downtown toronto,church-yonge corridor,entire condo,6,"lockbox, wine glasses, wifi, freezer, kitchen, hot water, private entrance, shampoo, shower gel, elevator, bathtub, stove, lake view, dishes and silverware, tv, washer, toaster, iron, dishwasher, city skyline view, cooking basics, smoke alarm, coffee maker: drip coffee maker, self check-in, hangers, hair dryer, extra pillows and blankets, carbon monoxide alarm, cleaning products, microwave, air conditioning, essentials, free dryer, refrigerator, heating, paid parking garage on premises – 1 space, bed linens, long term stays allowed, body soap",319.0,1,365,4.77,downtown
modern apartment in historic home near trinity bellwoods,trinity-bellwoods,entire rental unit,2,"wine glasses, wifi, freezer, laundromat nearby, record player, dining table, kitchen, hot water, private entrance, shampoo, electric stove, shower gel, baking sheet, luggage dropoff allowed, books and reading material, coffee, dishes and silverware, tv, central air conditioning, dedicated workspace, game console, toaster, iron, dishwasher, paid street parking off premises, conditioner, cooking basics, smoke alarm, self check-in, oven, hangers, hair dryer, extra pillows and blankets, carbon monoxide alarm, cleaning products, fire extinguisher, microwave, sound system, coffee maker, hot water kettle, essentials, refrigerator, heating, exercise equipment, smart lock, bed linens, long term stays allowed, body soap",172.0,2,1125,4.8,"apartment, historic, modern, trinity-bellwoods"
cozy downtown city room,regent park,private room in home,1,"wine glasses, wifi, freezer, blender, dining table, kitchen, hot water, rice maker, shampoo, exterior security cameras on property, baking sheet, first aid kit, luggage dropoff allowed, books and reading material, clothing storage: closet, bathtub, stove, coffee, keypad, paid dryer, dishes and silverware, bidet, lock on bedroom door, coffee maker: french press, dedicated workspace, iron, central heating, cooking basics, smoke alarm, self check-in, cleaning available during stay, hangers, hair dryer, extra pillows and blankets, carbon monoxide alarm, fire extinguisher, microwave, air conditioning, hot water kettle, paid washer – in unit, essentials, refrigerator, bed linens, body soap",117.0,1,365,4.87,"city, cozy, downtown"
comfy private room downtown,wychwood,private room in rental unit,2,"wifi, kitchen, hot water, shampoo, shower gel, stove, keypad, dryer, dishes and silverware, washer, lock on bedroom door, dedicated workspace, cooking basics, smoke alarm, self check-in, hangers, hair dryer, fire extinguisher, carbon monoxide alarm, cleaning products, microwave, air conditioning, essentials, refrigerator, heating, long term stays allowed",35.0,28,60,4.0,"downtown, private, private room"
3rd floor large private room in safe neighbourhood,palmerston-little italy,private room in home,1,"lockbox, paid parking on premises, private living room, ethernet connection, kitchen, hot water, free street parking, shampoo, stove, dishes and silverware, lock on bedroom door, dedicated workspace, shared patio or balcony, iron, paid parking off premises, cooking basics, smoke alarm, self check-in, oven, hangers, fast wifi – 278 mbps, hair dryer, fire extinguisher, extra pillows and blankets, carbon monoxide alarm, microwave, shared backyard – fully fenced, coffee maker, essentials, refrigerator, heating, bed linens, long term stays allowed",43.0,28,90,4.5,"little italy, palmerston, private, private room, safe"
"near kipling station, toronto cozy room r2",princess-rosethorn,private room in bungalow,1,"wifi, dining table, kitchen, hot water, shampoo, exterior security cameras on property, shower gel, first aid kit, room-darkening shades, keypad, dishes and silverware, free dryer – in unit, central air conditioning, lock on bedroom door, dedicated workspace, free washer – in unit, iron, dishwasher, stainless steel electric stove, cooking basics, smoke alarm, self check-in, hangers, hair dryer, carbon monoxide alarm, fire extinguisher, portable fans, cleaning products, microwave, coffee maker, hot water kettle, essentials, refrigerator, heating, bed linens, long term stays allowed, toaster",46.0,28,60,4.97,"cozy, kipling"
self-contained studio apartment(on main floor),ionview,entire rental unit,3,"wine glasses, wifi, freezer, free washer – in building, clothing storage: wardrobe, dining table, kitchen, hot water, rice maker, shampoo, electric stove, baking sheet, luggage dropoff allowed, room-darkening shades, stainless steel single oven, keypad, dishes and silverware, central air conditioning, dedicated workspace, toaster, iron, dishwasher, central heating, conditioner, cooking basics, smoke alarm, coffee maker: drip coffee maker, self check-in, hangers, hair dryer, carbon monoxide alarm, cleaning products, microwave, long term stays allowed, hot water kettle, essentials, refrigerator, bed linens, 42 inch hdtv, free dryer – in building, body soap",161.0,28,365,4.86,"apartment, studio, view"
bright room with private bathroom,steeles,private room in home,2,"wifi, dining table, hot water, exterior security cameras on property, keypad, dishes and silverware, washer, lock on bedroom door, dedicated workspace, free parking on premises, kitchenette, smoke alarm, self check-in, carbon monoxide alarm, microwave, air conditioning, hot water kettle, refrigerator, heating, toaster",62.0,1,365,4.78,"bath, bright, private"
casa savoia,islington-city centre west,entire rental unit,2,"lockbox, wifi, outdoor dining area, kitchen, hot water, exterior security cameras on property, first aid kit, dishes and silverware, tv, washer, dedicated workspace, free parking on premises, iron, conditioner, cooking basics, smoke alarm, self check-in, hair dryer, carbon monoxide alarm, cleaning products, air conditioning, essentials, heating",125.0,28,1125,5.0,city
downtown waterfront retreat,waterfront communities-the island,entire rental unit,2,"drying rack for clothing, wine glasses, shared sauna, wifi, freezer, outdoor dining area, laundromat nearby, blender, dining table, kitchen, hot water, private entrance, shampoo, electric stove, shower gel, baking sheet, first aid kit, outdoor furniture, books and reading material, elevator, safe, bathtub, pool, lake view, stainless steel double oven, coffee, dishes and silverware, tv, free dryer – in unit, washer, dedicated workspace, clothing storage: closet and dresser, toaster, iron, paid parking garage off premises, harbor view, dishwasher, central heating, conditioner, cooking basics, smoke alarm, self check-in, hangers, hair dryer, extra pillows and blankets, carbon monoxide alarm, cleaning products, portable fans, fire extinguisher, microwave, private patio or balcony, air conditioning, hot water kettle, waterfront, gym in building, essentials, lake access, sun loungers, refrigerator, exercise equipment, smart lock, bed linens, coffee maker: nespresso, bbq grill, body soap",223.0,1,25,4.98,"downtown, waterfront"
lovely 1 br in tos coolest hood,little portugal,entire home,3,"wine glasses, wifi, freezer, dining table, kitchen, hot water, private entrance, baking sheet, radiant heating, bathtub, stove, coffee, dishes and silverware, tv, shared patio or balcony, clothing storage: closet and dresser, toaster, dishwasher, cooking basics, smoke alarm, oven, hangers, hair dryer, fire extinguisher, extra pillows and blankets, carbon monoxide alarm, microwave, air conditioning, hot water kettle, essentials, refrigerator, bed linens, long term stays allowed, coffee maker: french press",79.0,28,365,4.5,
cozy 1-bedroom retreat in dovercourt village,dovercourt-wallace emerson-junction,entire home,2,"paid parking on premises, wifi, dining table, kitchen, hot water, exterior security cameras on property, bathtub, room-darkening shades, keypad, free dryer – in unit, central air conditioning, free washer – in unit, iron, dishwasher, central heating, smoke alarm, self check-in, hangers, hair dryer, fire extinguisher, carbon monoxide alarm, bed linens, coffee maker: nespresso",120.0,2,365,5.0,cozy
"private room, close to airport, 3 mins walk to bus",islington-city centre west,private room in home,1,"backyard - fully fenced, wine glasses, freezer, kirtland  body soap, blender, clothing storage: wardrobe, dining table, kitchen, hot water, exterior security cameras on property, shower gel, first aid kit, luggage dropoff allowed, park view, whirlpool stainless steel electric stove, room-darkening shades, coffee, dishes and silverware, free dryer – in unit, central air conditioning, lock on bedroom door, dedicated workspace, free washer – in unit, fast wifi – 578 mbps, kirtland  shampoo, central heating, conditioner, cooking basics, smoke alarm, coffee maker: drip coffee maker, self check-in, hangers, hair dryer, carbon monoxide alarm, fire extinguisher, cleaning products, microwave, hot water kettle, essentials, refrigerator, smart lock, bed linens, long term stays allowed, whirlpool  stainless steel single oven, toaster",50.0,1,365,5.0,"city, private, private room, walk to"
modern 2-br condo dt toronto,waterfront communities-the island,entire rental unit,4,"lockbox, wine glasses, paid parking on premises, wifi, freezer, gym, dining table, kitchen, hot water, shampoo, baking sheet, bathtub, stove, dryer, dishes and silverware, washer, iron, dishwasher, paid parking off premises, cooking basics, smoke alarm, self check-in, oven, hangers, hair dryer, microwave, air conditioning, coffee maker, hot water kettle, essentials, refrigerator, heating, exercise equipment, bed linens, long term stays allowed, bbq grill",250.0,1,365,3.67,"condo, modern, waterfront"
dt cn tower view grand deluxe suite free parking,kensington-chinatown,private room in home,2,"lockbox, wifi, ethernet connection, freezer, dining table, kitchen, hot water, private entrance, shampoo, exterior security cameras on property, clothing storage, shower gel, baking sheet, outlet covers, room-darkening shades, stainless steel single oven, dishes and silverware, washer, lock on bedroom door, dedicated workspace, free parking on premises, central heating, conditioner, cooking basics, smoke alarm, self check-in, hangers, hair dryer, other stainless steel induction stove, cleaning products, microwave, air conditioning, hot water kettle, refrigerator, bed linens, shared backyard, free dryer – in building, body soap",68.0,1,365,4.7,"deluxe, free parking, king, parking, suite, view"
chic condo in trendy queen west,little portugal,private room in condo,2,"wifi, gym, kitchen, hot water, building staff, elevator, lake view, dryer, tv, washer, lock on bedroom door, iron, city skyline view, smoke alarm, self check-in, hangers, carbon monoxide alarm, air conditioning, essentials, heating, long term stays allowed",75.0,28,1125,5.0,condo
comfortable vintage vibe villa w/ free parking,waterfront communities-the island,entire rental unit,4,"drying rack for clothing, wine glasses, wifi, freezer, dining table, kitchen, hot water, free residential garage on premises – 1 space, shampoo, shower gel, clothing storage, outdoor furniture, first aid kit, elevator, bathtub, stove, coffee, dryer, dishes and silverware, tv, washer, dedicated workspace, toaster, iron, dishwasher, conditioner, cooking basics, smoke alarm, oven, hangers, hair dryer, extra pillows and blankets, carbon monoxide alarm, cleaning products, fire extinguisher, microwave, patio or balcony, air conditioning, coffee maker, trash compactor, hot water kettle, waterfront, essentials, refrigerator, heating, bed linens, body soap",326.0,1,365,4.71,"free parking, king, parking, waterfront"
"2br sunnyside to skyline | lakeview, pool, sauna",high park-swansea,entire condo,3,"single level home, shared sauna, freezer, outdoor dining area, blender, dining table, kitchen, hot water, board games, shampoo, beach access – beachfront, shower gel, baking sheet, first aid kit, outdoor furniture, park view, elevator, luggage dropoff allowed, bathtub, room-darkening shades, exercise equipment: treadmill, stove, lake view, shared indoor pool - available all year, dishes and silverware, free dryer – in unit, washer, central air conditioning, fast wifi – 442 mbps, dedicated workspace, clothing storage: closet and dresser, toaster, dishwasher, central heating, coffee maker: french press, nespresso, city skyline view, conditioner, smoke alarm, cooking basics, oven, paid pack ’n play/travel crib - available upon request, free resort access, self check-in, cleaning available during stay, hangers, tv with amazon prime video, chromecast, netflix, extra pillows and blankets, carbon monoxide alarm, fire extinguisher, cleaning products, portable fans, microwave, private patio or balcony, hot water kettle, shared gym in building, waterfront, essentials, lake access, sun loungers, refrigerator, smart lock, free parking garage on premises, bed linens, shared backyard, paid crib - available upon request, long term stays allowed, body soap",158.0,28,60,5.0,"high park, lakeview, sunny, view"
"entire industrial style comfort condo, 1bed 2bth",roncesvalles,private room in condo,3,"lockbox, wine glasses, private living room, single level home, freezer, ethernet connection, outdoor dining area, pets allowed, kitchen, hot water, private entrance, free street parking, electric stove, shower gel, baking sheet, first aid kit, free parking garage on premises – 1 space, books and reading material, elevator, clothing storage: closet, bathtub, room-darkening shades, various conditioner, dishes and silverware, free dryer – in unit, 47 inch hdtv with amazon prime video, roku, standard cable, netflix, dedicated workspace, coffee maker: drip coffee maker, french press, free washer – in unit, various shampoo, iron, dishwasher, central heating, various body soap, cooking basics, smoke alarm, fast wifi – 719 mbps, oven, self check-in, hair dryer, extra pillows and blankets, carbon monoxide alarm, cleaning products, fire extinguisher, microwave, private patio or balcony, air conditioning, hot water kettle, shared gym in building, essentials, refrigerator, paid parking garage on premises – 1 space, bed linens, outdoor playground, long term stays allowed, toaster",161.0,2,40,5.0,condo
